{"schemaVersion":2,"generatedAt":"2026-10-04T22:18:08.761997+00:00","dataVintage":"2026-10-04T213333.710331Z","forecastOrigin":"2026-09-01","horizonMonths":6,"level":80,"coverage":{"included":["wheat","maize","rice"],"missing":[]},"totalUniqueId":null,"points":[{"unique_id":"maize","ds":"2026-10-01","yhat":239.6,"lo":218.05,"hi":263.28,"bands":[{"level":50,"lo":230.54,"hi":249.02},{"level":80,"lo":218.05,"hi":263.28},{"level":95,"lo":203.12,"hi":282.63}]},{"unique_id":"maize","ds":"2026-11-01","yhat":239.6,"lo":206.84,"hi":277.55,"bands":[{"level":50,"lo":226.98,"hi":252.92},{"level":80,"lo":206.84,"hi":277.55},{"level":95,"lo":192.43,"hi":298.33}]},{"unique_id":"maize","ds":"2026-12-01","yhat":239.6,"lo":194.26,"hi":295.52,"bands":[{"level":50,"lo":218.35,"hi":262.91},{"level":80,"lo":194.26,"hi":295.52},{"level":95,"lo":188.89,"hi":303.92}]},{"unique_id":"maize","ds":"2027-01-01","yhat":239.6,"lo":189.93,"hi":302.25,"bands":[{"level":50,"lo":211.03,"hi":272.04},{"level":80,"lo":189.93,"hi":302.25},{"level":95,"lo":169.71,"hi":338.27}]},{"unique_id":"maize","ds":"2027-02-01","yhat":239.6,"lo":186.24,"hi":308.24,"bands":[{"level":50,"lo":212.56,"hi":270.08},{"level":80,"lo":186.24,"hi":308.24},{"level":95,"lo":156.02,"hi":367.96}]},{"unique_id":"maize","ds":"2027-03-01","yhat":239.6,"lo":178.37,"hi":321.84,"bands":[{"level":50,"lo":215.64,"hi":266.22},{"level":80,"lo":178.37,"hi":321.84},{"level":95,"lo":162.31,"hi":353.7}]},{"unique_id":"rice","ds":"2026-10-01","yhat":482.0,"lo":444.92,"hi":522.17,"bands":[{"level":50,"lo":459.56,"hi":505.54},{"level":80,"lo":444.92,"hi":522.17},{"level":95,"lo":422.18,"hi":550.3}]},{"unique_id":"rice","ds":"2026-11-01","yhat":482.0,"lo":451.52,"hi":514.54,"bands":[{"level":50,"lo":464.89,"hi":499.74},{"level":80,"lo":451.52,"hi":514.54},{"level":95,"lo":416.84,"hi":557.35}]},{"unique_id":"rice","ds":"2026-12-01","yhat":482.0,"lo":453.1,"hi":512.74,"bands":[{"level":50,"lo":469.95,"hi":494.36},{"level":80,"lo":453.1,"hi":512.74},{"level":95,"lo":413.73,"hi":561.53}]},{"unique_id":"rice","ds":"2027-01-01","yhat":482.0,"lo":414.77,"hi":560.13,"bands":[{"level":50,"lo":451.52,"hi":514.54},{"level":80,"lo":414.77,"hi":560.13},{"level":95,"lo":369.19,"hi":629.28}]},{"unique_id":"rice","ds":"2027-02-01","yhat":482.0,"lo":415.52,"hi":559.12,"bands":[{"level":50,"lo":453.27,"hi":512.56},{"level":80,"lo":415.52,"hi":559.12},{"level":95,"lo":369.99,"hi":627.92}]},{"unique_id":"rice","ds":"2027-03-01","yhat":482.0,"lo":416.63,"hi":557.63,"bands":[{"level":50,"lo":456.04,"hi":509.44},{"level":80,"lo":416.63,"hi":557.63},{"level":95,"lo":367.24,"hi":632.62}]},{"unique_id":"wheat","ds":"2026-10-01","yhat":347.0,"lo":315.54,"hi":381.6,"bands":[{"level":50,"lo":331.31,"hi":363.43},{"level":80,"lo":315.54,"hi":381.6},{"level":95,"lo":288.79,"hi":416.94}]},{"unique_id":"wheat","ds":"2026-11-01","yhat":347.0,"lo":308.69,"hi":390.07,"bands":[{"level":50,"lo":322.06,"hi":373.87},{"level":80,"lo":308.69,"hi":390.07},{"level":95,"lo":289.09,"hi":416.51}]},{"unique_id":"wheat","ds":"2026-12-01","yhat":347.0,"lo":303.98,"hi":396.11,"bands":[{"level":50,"lo":320.0,"hi":376.28},{"level":80,"lo":303.98,"hi":396.11},{"level":95,"lo":268.87,"hi":447.84}]},{"unique_id":"wheat","ds":"2027-01-01","yhat":347.0,"lo":279.4,"hi":430.96,"bands":[{"level":50,"lo":322.0,"hi":373.94},{"level":80,"lo":279.4,"hi":430.96},{"level":95,"lo":252.73,"hi":476.43}]},{"unique_id":"wheat","ds":"2027-02-01","yhat":347.0,"lo":273.22,"hi":440.71,"bands":[{"level":50,"lo":305.58,"hi":394.04},{"level":80,"lo":273.22,"hi":440.71},{"level":95,"lo":250.33,"hi":480.99}]},{"unique_id":"wheat","ds":"2027-03-01","yhat":347.0,"lo":280.7,"hi":428.95,"bands":[{"level":50,"lo":310.35,"hi":387.98},{"level":80,"lo":280.7,"hi":428.95},{"level":95,"lo":240.89,"hi":499.84}]}],"runId":"2026-10-04T221808.761997Z","status":"experimental","evaluationBasis":"revised_history","series":{"wheat":{"unit":"USD / tonne","intervalStatus":"experimental"},"maize":{"unit":"USD / tonne","intervalStatus":"experimental"},"rice":{"unit":"USD / tonne","intervalStatus":"undercovered_in_recent_evaluation"}}}